{"database":{"adapter":"snapshot","dsn_secret_ref":null,"migration_table":"semaprax_migrations"},"http":{"adapter":"native","listen_origin":"https://service.invalid","tls_profile":"modern"},"mode":"host","schema":"semaprax.service-config.v1","secrets":{"password_pepper_ref":"auth.pepper","session_signing_key_ref":"auth.session","webhook_signing_key_ref":"webhook.signing"},"telemetry":{"adapter":"semaprax-json-events","endpoint_origin":"https://telemetry.invalid:9"}}
